LANGUAGE,English,French,Italian,Spanish,German,Comment,,,,,
STRC_01,,

STRCN_00,Training,Training,Training,Training,Training, Name of the mission
STRM_Reastdead,"THIS IS ALPHA BLACK. CONVOY IS DESTROYED I REPEAT CONVOY IS DESTROYED. ALPHA OUT.",alpha

STRM_Rbravoinpos,"ALPHA THIS IS BRAVO. IN POSITION. READY TO ROCK. BRAVO OUT.",bravo
STRM_Rwastem,"WASTE 'EM!",bravo

STRM_Rcharlieready,"CHARLIE TO ALPHA. READY. CHARLIE OUT.",charlie
STRM_Rmoving,"CHARLIE IS MOVING TO CUT OFF POINT. OVER.",charlie
