LANGUAGE,English,French,Italian,Spanish,German,Comment,,,,,
STRC_01,,

STRCN_00,Training,Training,Training,Training,Training, Name of the mission
STRM_Rmcomplete1,"PAPA BEAR THIS IS ALPHA BLACK. I HAVE CONDUCTED THE RECON OF NORTHERN PART OF THE AIRBASE. OVER.",seals first report
STRM_Rhqreply1,"ROGER ALPHA BLACK, PROCEED TO THE SOUTHERN PART. OVER.",hq reply 1
STRM_Rmcomplete2,"PAPA BEAR THIS IS ALPHA BLACK. I HAVE NOW LOCATED IN THE SOUTHERN PART OF THE AIRBASE. OVER.",seals second reply
STRM_Rhqreply2,"COPY THAT ALPHA, PROCEED TO THE EXTRACTION POINT AND COME HOME. OVER.",hq reply 2
STRM_Rswim,"PAPA BEAR THIS IS ALPHA BLACK. RECON COMPLETED. I HAVE SOME GOOD INTEL FOR YOU. TAKING A SWIM, SEE YOU SOON. OVER.",seals swim

