LANGUAGE,English,French,Italian,Spanish,German,Comment,,,,,
STRC_01,,

STRCN_00,Training,Training,Training,Training,Training, Name of the mission
STRM_Rcallair,"ALPHA BLACK TO AIR UNITS. YOU ARE FREE TO ENGAGE. OVER.",alpha
STRM_Rcallground,"ALPHA BLACK TO GROUND UNITS. ASSAULT IS GO. MOVE IT. OVER.",alpha
STRM_Reastdead1,"ALPHA BLACK TO PAPA BEAR. ITS OUR PLEASURE TO INFORM YOU THAT NOGOVA AIRBASE IS NOW UNDER NATO CONTROL. ALPHA OUT.",alpha

STRM_Rhqreply1,"PAPA BEAR TO ALPHA BLACK. ROGER THAT ALPHA BLACK. I AM GLAD TO HEAR THAT. MISSION ACCOMPLISHED. OVER.",hq

STRD_Rmissname,"Freedom",missionname
STRL_Rload,"East of Nogova airbase, H Hour.",loadname
