LANGUAGE,English,French,Italian,Spanish,German,Comment,,,,,
STRC_01,,

STRCN_00,Training,Training,Training,Training,Training, Name of the mission
STRM_R1complete,"THIS IS ALPHA BLACK. FIRST OBJECTIVE IS SECURE. OVER.",waiting
STRM_Rhqreply1,"COPY THAT ALPHA BLACK. SENDING REINFORCEMENTS. STAY PUT. OVER.",hqreply1
STRM_R1compreply,"ROGER THAT PAPABEAR. WE WILL HOLD THE CITY. OUT.",copyorders
STRM_Rneworders,"ALPHA BLACK THIS IS PAPABEAR. WE HAVE NEW ORDERS FOR YOU. PROCEED TO THE ENEMY FIELD HQ AND DESTROY SUPPORT TRUCKS. OVER.",jep
STRM_Rgoodjob,"GOOD JOB EVERYONE. THE SUPPORT TRUCKS HAVE BEEN NEUTRALIZED. OVER.",neutral
