LANGUAGE,English,French,Italian,Spanish,German,Comment,,,,,
STRC_01,,

STRCN_00,Training,Training,Training,Training,Training, Name of the mission
STRM_Reastdead,"ALPHA TO PAPA BEAR. THE RUSSIANS ARE EITHER DEAD OR FLEEING. OVER.",alpha
STRM_Rbackup,"ALPHA TO GOLF. YOU ARE CLEARED TO PROCEED INTO THE LZ. AREA IS SECURE. OVER.",alpha

STRM_Ronway,"ROGER ALPHA. ON OUR WAY. ETA THREE MINUTES. OVER.",backup

STRM_Rgunships,"GUNSHIPS ARE NOW REFUELED AND ARMED. ETA FEW MINUTES. PAPA BEAR OUT.",hq
STRM_Rmcomplete,"GOOD JOB EVERYONE. OUR OBJECTIVES ARE MET. PAPA BEAR OUT.",hq
STRM_Rcopyclear,"COPY THAT. SECURE THE LANDING ZONE AND CALL THE BACKUP FORCES. OVER.",hq
