LANGUAGE,English,French,Italian,Spanish,German,Comment,,,,,
STRC_01,,

STRCN_00,Training,Training,Training,Training,Training, Name of the mission
STRM_Reastdead,"ALPHA BLACK TO PAPA BEAR. WE HAVE CAPTURED THE OBJECTIVE. OVER.",alpha
STRM_Rreinfdead,"ALPHA TO PAPA BEAR. REINFORCEMENTS HAVE BEEN PUSH BACK. OVER.",alpha

STRM_Rreinf,"PAPA BEAR TO ALPHA. THATS A COPY. STAY ALERT FOR ENEMY REINFORCEMENTS FROM NORTH. OVER.",hq
STRM_Rmcomplete,"PAPA BEAR TO ALPHA BLACK. ROGER. GOOD WORK. MISSION ACCOMPLISHED. OVER.",hq

STRD_Rmissname,"Proud Eagle",missionname
STRL_Rload,"Rumble in the Ruins",loadname
